ubuntu@ip-172-31-41-50:~/KJ-WEBPROXY-LAB$ sudo tcpdump -i enX0 port 8080
tcpdump: verbose output suppressed, use -v[v]... for full protocol decode
listening on enX0, link-type EN10MB (Ethernet), snapshot length 262144 bytes
23:41:10.842109 IP 1.238.129.195.53973 > ip-172-31-41-50.ap-northeast-2.compute.internal.http-alt: Flags [S], seq 59603717, win 65535, options [mss 1460,nop,wscale 6,nop,nop,TS val 2304024048 ecr 0,sackOK,eol], length 0
23:41:10.842128 IP ip-172-31-41-50.ap-northeast-2.compute.internal.http-alt > 1.238.129.195.53973: Flags [S.], seq 3275443333, ack 59603718, win 62643, options [mss 8961,sackOK,TS val 1535692069 ecr 2304024048,nop,wscale 7], length 0
23:41:10.842247 IP 1.238.129.195.53974 > ip-172-31-41-50.ap-northeast-2.compute.internal.http-alt: Flags [S], seq 3234181360, win 65535, options [mss 1460,nop,wscale 6,nop,nop,TS val 1651149973 ecr 0,sackOK,eol], length 0
23:41:10.842252 IP ip-172-31-41-50.ap-northeast-2.compute.internal.http-alt > 1.238.129.195.53974: Flags [S.], seq 2703594255, ack 3234181361, win 62643, options [mss 8961,sackOK,TS val 1535692069 ecr 1651149973,nop,wscale 7], length 0
23:41:10.849092 IP 1.238.129.195.53974 > ip-172-31-41-50.ap-northeast-2.compute.internal.http-alt: Flags [.], ack 1, win 2059, options [nop,nop,TS val 1651149982 ecr 1535692069], length 0
23:41:10.849512 IP 1.238.129.195.53973 > ip-172-31-41-50.ap-northeast-2.compute.internal.http-alt: Flags [.], ack 1, win 2059, options [nop,nop,TS val 2304024057 ecr 1535692069], length 0
23:41:10.849699 IP 1.238.129.195.53974 > ip-172-31-41-50.ap-northeast-2.compute.internal.http-alt: Flags [P.], seq 1:505, ack 1, win 2059, options [nop,nop,TS val 1651149982 ecr 1535692069], length 504: HTTP: GET / HTTP/1.1
23:41:10.849707 IP ip-172-31-41-50.ap-northeast-2.compute.internal.http-alt > 1.238.129.195.53974: Flags [.], ack 505, win 486, options [nop,nop,TS val 1535692076 ecr 1651149982], length 0
23:41:10.850467 IP ip-172-31-41-50.ap-northeast-2.compute.internal.http-alt > 1.238.129.195.53974: Flags [P.], seq 1:110, ack 505, win 486, options [nop,nop,TS val 1535692077 ecr 1651149982], length 109: HTTP: HTTP/1.0 200 OK
23:41:10.850509 IP ip-172-31-41-50.ap-northeast-2.compute.internal.http-alt > 1.238.129.195.53974: Flags [FP.], seq 110:957, ack 505, win 486, options [nop,nop,TS val 1535692077 ecr 1651149982], length 847: HTTP
23:41:10.857006 IP 1.238.129.195.53974 > ip-172-31-41-50.ap-northeast-2.compute.internal.http-alt: Flags [.], ack 110, win 2058, options [nop,nop,TS val 1651149989 ecr 1535692077], length 0
23:41:10.857133 IP 1.238.129.195.53974 > ip-172-31-41-50.ap-northeast-2.compute.internal.http-alt: Flags [.], ack 958, win 2045, options [nop,nop,TS val 1651149989 ecr 1535692077], length 0
23:41:10.858153 IP 1.238.129.195.53974 > ip-172-31-41-50.ap-northeast-2.compute.internal.http-alt: Flags [F.], seq 505, ack 958, win 2048, options [nop,nop,TS val 1651149990 ecr 1535692077], length 0
23:41:10.858163 IP ip-172-31-41-50.ap-northeast-2.compute.internal.http-alt > 1.238.129.195.53974: Flags [.], ack 506, win 486, options [nop,nop,TS val 1535692085 ecr 1651149990], length 0
23:41:10.913943 IP 1.238.129.195.53973 > ip-172-31-41-50.ap-northeast-2.compute.internal.http-alt: Flags [P.], seq 1:412, ack 1, win 2059, options [nop,nop,TS val 2304024122 ecr 1535692069], length 411: HTTP: GET /30mb.mp4 HTTP/1.1
23:41:10.913955 IP ip-172-31-41-50.ap-northeast-2.compute.internal.http-alt > 1.238.129.195.53973: Flags [.], ack 412, win 487, options [nop,nop,TS val 1535692141 ecr 2304024122], length 0
23:41:10.914597 IP ip-172-31-41-50.ap-northeast-2.compute.internal.http-alt > 1.238.129.195.53973: Flags [P.], seq 1:115, ack 412, win 487, options [nop,nop,TS val 1535692141 ecr 2304024122], length 114: HTTP: HTTP/1.0 200 OK
23:41:10.922615 IP 1.238.129.195.53973 > ip-172-31-41-50.ap-northeast-2.compute.internal.http-alt: Flags [.], ack 115, win 2058, options [nop,nop,TS val 2304024129 ecr 1535692141], length 0
23:41:10.940416 IP ip-172-31-41-50.ap-northeast-2.compute.internal.http-alt > 1.238.129.195.53973: Flags [P.], seq 115:3011, ack 412, win 487, options [nop,nop,TS val 1535692167 ecr 2304024129], length 2896: HTTP
23:41:10.940443 IP ip-172-31-41-50.ap-northeast-2.compute.internal.http-alt > 1.238.129.195.53973: Flags [P.], seq 3011:5907, ack 412, win 487, options [nop,nop,TS val 1535692167 ecr 2304024129], length 2896: HTTP
23:41:10.940518 IP ip-172-31-41-50.ap-northeast-2.compute.internal.http-alt > 1.238.129.195.53973: Flags [P.], seq 5907:8803, ack 412, win 487, options [nop,nop,TS val 1535692167 ecr 2304024129], length 2896: HTTP
23:41:10.940547 IP ip-172-31-41-50.ap-northeast-2.compute.internal.http-alt > 1.238.129.195.53973: Flags [P.], seq 8803:11699, ack 412, win 487, options [nop,nop,TS val 1535692167 ecr 2304024129], length 2896: HTTP
23:41:10.940577 IP ip-172-31-41-50.ap-northeast-2.compute.internal.http-alt > 1.238.129.195.53973: Flags [P.], seq 11699:14595, ack 412, win 487, options [nop,nop,TS val 1535692167 ecr 2304024129], length 2896: HTTP
23:41:10.949412 IP 1.238.129.195.53973 > ip-172-31-41-50.ap-northeast-2.compute.internal.http-alt: Flags [.], ack 3011, win 2013, options [nop,nop,TS val 2304024157 ecr 1535692167], length 0
23:41:10.949419 IP ip-172-31-41-50.ap-northeast-2.compute.internal.http-alt > 1.238.129.195.53973: Flags [P.], seq 14595:18939, ack 412, win 487, options [nop,nop,TS val 1535692176 ecr 2304024157], length 4344: HTTP
23:41:10.951106 IP 1.238.129.195.53973 > ip-172-31-41-50.ap-northeast-2.compute.internal.http-alt: Flags [.], ack 14595, win 1867, options [nop,nop,TS val 2304024158 ecr 1535692167], length 0
23:41:10.951106 IP 1.238.129.195.53973 > ip-172-31-41-50.ap-northeast-2.compute.internal.http-alt: Flags [.], ack 14595, win 2048, options [nop,nop,TS val 2304024158 ecr 1535692167], length 0
23:41:10.951133 IP ip-172-31-41-50.ap-northeast-2.compute.internal.http-alt > 1.238.129.195.53973: Flags [P.], seq 18939:24731, ack 412, win 487, options [nop,nop,TS val 1535692178 ecr 2304024158], length 5792: HTTP
23:41:10.951144 IP ip-172-31-41-50.ap-northeast-2.compute.internal.http-alt > 1.238.129.195.53973: Flags [P.], seq 24731:30523, ack 412, win 487, options [nop,nop,TS val 1535692178 ecr 2304024158], length 5792: HTTP
23:41:10.951231 IP ip-172-31-41-50.ap-northeast-2.compute.internal.http-alt > 1.238.129.195.53973: Flags [P.], seq 30523:36315, ack 412, win 487, options [nop,nop,TS val 1535692178 ecr 2304024158], length 5792: HTTP
23:41:10.951256 IP ip-172-31-41-50.ap-northeast-2.compute.internal.http-alt > 1.238.129.195.53973: Flags [P.], seq 36315:42107, ack 412, win 487, options [nop,nop,TS val 1535692178 ecr 2304024158], length 5792: HTTP
23:41:10.951311 IP ip-172-31-41-50.ap-northeast-2.compute.internal.http-alt > 1.238.129.195.53973: Flags [.], seq 42107:43555, ack 412, win 487, options [nop,nop,TS val 1535692178 ecr 2304024158], length 1448: HTTP
23:41:10.959793 IP 1.238.129.195.53973 > ip-172-31-41-50.ap-northeast-2.compute.internal.http-alt: Flags [.], ack 20387, win 1958, options [nop,nop,TS val 2304024167 ecr 1535692178], length 0
23:41:10.959802 IP ip-172-31-41-50.ap-northeast-2.compute.internal.http-alt > 1.238.129.195.53973: Flags [P.], seq 43555:50795, ack 412, win 487, options [nop,nop,TS val 1535692186 ecr 2304024167], length 7240: HTTP
23:41:10.959854 IP 1.238.129.195.53973 > ip-172-31-41-50.ap-northeast-2.compute.internal.http-alt: Flags [.], ack 20387, win 2048, options [nop,nop,TS val 2304024167 ecr 1535692178], length 0
23:41:10.959922 IP 1.238.129.195.53973 > ip-172-31-41-50.ap-northeast-2.compute.internal.http-alt: Flags [.], ack 23283, win 2003, options [nop,nop,TS val 2304024168 ecr 1535692178], length 0
23:41:10.959929 IP ip-172-31-41-50.ap-northeast-2.compute.internal.http-alt > 1.238.129.195.53973: Flags [P.], seq 50795:59483, ack 412, win 487, options [nop,nop,TS val 1535692187 ecr 2304024168], length 8688: HTTP
23:41:10.961387 IP 1.238.129.195.53973 > ip-172-31-41-50.ap-northeast-2.compute.internal.http-alt: Flags [.], ack 39211, win 1800, options [nop,nop,TS val 2304024169 ecr 1535692178], length 0
23:41:10.961395 IP ip-172-31-41-50.ap-northeast-2.compute.internal.http-alt > 1.238.129.195.53973: Flags [P.], seq 59483:71067, ack 412, win 487, options [nop,nop,TS val 1535692188 ecr 2304024169], length 11584: HTTP
23:41:10.961496 IP ip-172-31-41-50.ap-northeast-2.compute.internal.http-alt > 1.238.129.195.53973: Flags [P.], seq 71067:73963, ack 412, win 487, options [nop,nop,TS val 1535692188 ecr 2304024169], length 2896: HTTP
23:41:10.961504 IP ip-172-31-41-50.ap-northeast-2.compute.internal.http-alt > 1.238.129.195.53973: Flags [P.], seq 73963:85547, ack 412, win 487, options [nop,nop,TS val 1535692188 ecr 2304024169], length 11584: HTTP
23:41:10.961576 IP 1.238.129.195.53973 > ip-172-31-41-50.ap-northeast-2.compute.internal.http-alt: Flags [.], ack 43555, win 1733, options [nop,nop,TS val 2304024169 ecr 1535692178], length 0
23:41:10.961585 IP ip-172-31-41-50.ap-northeast-2.compute.internal.http-alt > 1.238.129.195.53973: Flags [P.], seq 85547:97131, ack 412, win 487, options [nop,nop,TS val 1535692188 ecr 2304024169], length 11584: HTTP
23:41:10.961596 IP ip-172-31-41-50.ap-northeast-2.compute.internal.http-alt > 1.238.129.195.53973: Flags [P.], seq 97131:101475, ack 412, win 487, options [nop,nop,TS val 1535692188 ecr 2304024169], length 4344: HTTP
23:41:10.962646 IP 1.238.129.195.53973 > ip-172-31-41-50.ap-northeast-2.compute.internal.http-alt: Flags [.], ack 43555, win 2048, options [nop,nop,TS val 2304024169 ecr 1535692178], length 0
23:41:10.968496 IP 1.238.129.195.53973 > ip-172-31-41-50.ap-northeast-2.compute.internal.http-alt: Flags [.], ack 46451, win 2003, options [nop,nop,TS val 2304024176 ecr 1535692186], length 0
23:41:10.968499 IP ip-172-31-41-50.ap-northeast-2.compute.internal.http-alt > 1.238.129.195.53973: Flags [P.], seq 101475:107267, ack 412, win 487, options [nop,nop,TS val 1535692195 ecr 2304024176], length 5792: HTTP
23:41:10.969470 IP 1.238.129.195.53973 > ip-172-31-41-50.ap-northeast-2.compute.internal.http-alt: Flags [.], ack 62379, win 1800, options [nop,nop,TS val 2304024177 ecr 1535692188], length 0
23:41:10.969475 IP ip-172-31-41-50.ap-northeast-2.compute.internal.http-alt > 1.238.129.195.53973: Flags [P.], seq 107267:123195, ack 412, win 487, options [nop,nop,TS val 1535692196 ecr 2304024177], length 15928: HTTP
23:41:10.969487 IP ip-172-31-41-50.ap-northeast-2.compute.internal.http-alt > 1.238.129.195.53973: Flags [P.], seq 123195:139123, ack 412, win 487, options [nop,nop,TS val 1535692196 ecr 2304024177], length 15928: HTTP
23:41:10.969495 IP 1.238.129.195.53973 > ip-172-31-41-50.ap-northeast-2.compute.internal.http-alt: Flags [.], ack 62379, win 2048, options [nop,nop,TS val 2304024177 ecr 1535692188], length 0
23:41:10.970778 IP 1.238.129.195.53973 > ip-172-31-41-50.ap-northeast-2.compute.internal.http-alt: Flags [.], ack 78307, win 1800, options [nop,nop,TS val 2304024179 ecr 1535692188], length 0
23:41:10.970793 IP ip-172-31-41-50.ap-northeast-2.compute.internal.http-alt > 1.238.129.195.53973: Flags [P.], seq 139123:157947, ack 412, win 487, options [nop,nop,TS val 1535692197 ecr 2304024179], length 18824: HTTP
23:41:10.970815 IP 1.238.129.195.53973 > ip-172-31-41-50.ap-northeast-2.compute.internal.http-alt: Flags [.], ack 94235, win 1552, options [nop,nop,TS val 2304024179 ecr 1535692188], length 0
23:41:10.970823 IP ip-172-31-41-50.ap-northeast-2.compute.internal.http-alt > 1.238.129.195.53973: Flags [P.], seq 157947:181115, ack 412, win 487, options [nop,nop,TS val 1535692197 ecr 2304024179], length 23168: HTTP
23:41:10.970865 IP 1.238.129.195.53973 > ip-172-31-41-50.ap-northeast-2.compute.internal.http-alt: Flags [.], ack 94235, win 2048, options [nop,nop,TS val 2304024179 ecr 1535692188], length 0
23:41:10.970942 IP 1.238.129.195.53973 > ip-172-31-41-50.ap-northeast-2.compute.internal.http-alt: Flags [.], ack 101475, win 1935, options [nop,nop,TS val 2304024179 ecr 1535692188], length 0
23:41:10.970942 IP 1.238.129.195.53973 > ip-172-31-41-50.ap-northeast-2.compute.internal.http-alt: Flags [.], ack 101475, win 2048, options [nop,nop,TS val 2304024179 ecr 1535692188], length 0
23:41:10.970954 IP ip-172-31-41-50.ap-northeast-2.compute.internal.http-alt > 1.238.129.195.53973: Flags [P.], seq 181115:204283, ack 412, win 487, options [nop,nop,TS val 1535692198 ecr 2304024179], length 23168: HTTP
23:41:10.971018 IP ip-172-31-41-50.ap-northeast-2.compute.internal.http-alt > 1.238.129.195.53973: Flags [P.], seq 204283:217315, ack 412, win 487, options [nop,nop,TS val 1535692198 ecr 2304024179], length 13032: HTTP
23:41:10.978482 IP 1.238.129.195.53973 > ip-172-31-41-50.ap-northeast-2.compute.internal.http-alt: Flags [.], ack 117403, win 4175, options [nop,nop,TS val 2304024186 ecr 1535692196], length 0
23:41:10.978488 IP ip-172-31-41-50.ap-northeast-2.compute.internal.http-alt > 1.238.129.195.53973: Flags [P.], seq 217315:244827, ack 412, win 487, options [nop,nop,TS val 1535692205 ecr 2304024186], length 27512: HTTP
23:41:10.978652 IP 1.238.129.195.53973 > ip-172-31-41-50.ap-northeast-2.compute.internal.http-alt: Flags [.], ack 133331, win 3927, options [nop,nop,TS val 2304024186 ecr 1535692196], length 0
23:41:10.978657 IP ip-172-31-41-50.ap-northeast-2.compute.internal.http-alt > 1.238.129.195.53973: Flags [P.], seq 244827:269443, ack 412, win 487, options [nop,nop,TS val 1535692205 ecr 2304024186], length 24616: HTTP
23:41:10.978680 IP 1.238.129.195.53973 > ip-172-31-41-50.ap-northeast-2.compute.internal.http-alt: Flags [.], ack 139123, win 3837, options [nop,nop,TS val 2304024186 ecr 1535692196], length 0
23:41:10.978923 IP 1.238.129.195.53973 > ip-172-31-41-50.ap-northeast-2.compute.internal.http-alt: Flags [.], ack 139123, win 4424, options [nop,nop,TS val 2304024186 ecr 1535692196], length 0
23:41:10.978955 IP 1.238.129.195.53973 > ip-172-31-41-50.ap-northeast-2.compute.internal.http-alt: Flags [.], ack 142019, win 4379, options [nop,nop,TS val 2304024186 ecr 1535692197], length 0
23:41:10.980105 IP 1.238.129.195.53973 > ip-172-31-41-50.ap-northeast-2.compute.internal.http-alt: Flags [.], ack 188355, win 4424, options [nop,nop,TS val 2304024187 ecr 1535692197], length 0
23:41:10.980118 IP ip-172-31-41-50.ap-northeast-2.compute.internal.http-alt > 1.238.129.195.53973: Flags [P.], seq 269443:312883, ack 412, win 487, options [nop,nop,TS val 1535692207 ecr 2304024187], length 43440: HTTP
23:41:10.980155 IP ip-172-31-41-50.ap-northeast-2.compute.internal.http-alt > 1.238.129.195.53973: Flags [P.], seq 312883:334603, ack 412, win 487, options [nop,nop,TS val 1535692207 ecr 2304024187], length 21720: HTTP
23:41:10.980162 IP ip-172-31-41-50.ap-northeast-2.compute.internal.http-alt > 1.238.129.195.53973: Flags [P.], seq 334603:378043, ack 412, win 487, options [nop,nop,TS val 1535692207 ecr 2304024187], length 43440: HTTP
23:41:10.980174 IP 1.238.129.195.53973 > ip-172-31-41-50.ap-northeast-2.compute.internal.http-alt: Flags [.], ack 217315, win 4424, options [nop,nop,TS val 2304024187 ecr 1535692198], length 0
23:41:10.980462 IP ip-172-31-41-50.ap-northeast-2.compute.internal.http-alt > 1.238.129.195.53973: Flags [P.], seq 378043:399763, ack 412, win 487, options [nop,nop,TS val 1535692207 ecr 2304024187], length 21720: HTTP
23:41:10.980488 IP ip-172-31-41-50.ap-northeast-2.compute.internal.http-alt > 1.238.129.195.53973: Flags [P.], seq 399763:448995, ack 412, win 487, options [nop,nop,TS val 1535692207 ecr 2304024187], length 49232: HTTP
23:41:10.989272 IP 1.238.129.195.53973 > ip-172-31-41-50.ap-northeast-2.compute.internal.http-alt: Flags [.], ack 233243, win 6981, options [nop,nop,TS val 2304024195 ecr 1535692205], length 0
23:41:10.989283 IP ip-172-31-41-50.ap-northeast-2.compute.internal.http-alt > 1.238.129.195.53973: Flags [P.], seq 448995:464923, ack 412, win 487, options [nop,nop,TS val 1535692216 ecr 2304024195], length 15928: HTTP
23:41:10.989440 IP 1.238.129.195.53973 > ip-172-31-41-50.ap-northeast-2.compute.internal.http-alt: Flags [.], ack 254963, win 7230, options [nop,nop,TS val 2304024195 ecr 1535692205], length 0
23:41:10.989440 IP 1.238.129.195.53973 > ip-172-31-41-50.ap-northeast-2.compute.internal.http-alt: Flags [.], ack 269443, win 7230, options [nop,nop,TS val 2304024195 ecr 1535692205], length 0
23:41:10.989440 IP 1.238.129.195.53973 > ip-172-31-41-50.ap-northeast-2.compute.internal.http-alt: Flags [.], ack 308539, win 7230, options [nop,nop,TS val 2304024197 ecr 1535692207], length 0
23:41:10.989449 IP ip-172-31-41-50.ap-northeast-2.compute.internal.http-alt > 1.238.129.195.53973: Flags [P.], seq 464923:519947, ack 412, win 487, options [nop,nop,TS val 1535692216 ecr 2304024195], length 55024: HTTP
23:41:10.989475 IP ip-172-31-41-50.ap-northeast-2.compute.internal.http-alt > 1.238.129.195.53973: Flags [P.], seq 519947:530083, ack 412, win 487, options [nop,nop,TS val 1535692216 ecr 2304024195], length 10136: HTTP
23:41:10.989482 IP ip-172-31-41-50.ap-northeast-2.compute.internal.http-alt > 1.238.129.195.53973: Flags [P.], seq 530083:595243, ack 412, win 487, options [nop,nop,TS val 1535692216 ecr 2304024197], length 65160: HTTP
23:41:10.989730 IP 1.238.129.195.53973 > ip-172-31-41-50.ap-northeast-2.compute.internal.http-alt: Flags [.], ack 354875, win 7230, options [nop,nop,TS val 2304024197 ecr 1535692207], length 0
23:41:10.989744 IP ip-172-31-41-50.ap-northeast-2.compute.internal.http-alt > 1.238.129.195.53973: Flags [P.], seq 595243:660403, ack 412, win 487, options [nop,nop,TS val 1535692216 ecr 2304024197], length 65160: HTTP
23:41:10.989762 IP 1.238.129.195.53973 > ip-172-31-41-50.ap-northeast-2.compute.internal.http-alt: Flags [.], ack 393971, win 7230, options [nop,nop,TS val 2304024198 ecr 1535692207], length 0
23:41:10.989975 IP ip-172-31-41-50.ap-northeast-2.compute.internal.http-alt > 1.238.129.195.53973: Flags [P.], seq 660403:725563, ack 412, win 487, options [nop,nop,TS val 1535692217 ecr 2304024198], length 65160: HTTP
23:41:10.990110 IP ip-172-31-41-50.ap-northeast-2.compute.internal.http-alt > 1.238.129.195.53973: Flags [P.], seq 725563:790723, ack 412, win 487, options [nop,nop,TS val 1535692217 ecr 2304024198], length 65160: HTTP
23:41:10.990925 IP 1.238.129.195.53973 > ip-172-31-41-50.ap-northeast-2.compute.internal.http-alt: Flags [.], ack 441755, win 7230, options [nop,nop,TS val 2304024198 ecr 1535692207], length 0
23:41:10.990936 IP ip-172-31-41-50.ap-northeast-2.compute.internal.http-alt > 1.238.129.195.53973: Flags [P.], seq 790723:855883, ack 412, win 487, options [nop,nop,TS val 1535692218 ecr 2304024198], length 65160: HTTP
23:41:10.990999 IP 1.238.129.195.53973 > ip-172-31-41-50.ap-northeast-2.compute.internal.http-alt: Flags [.], ack 448995, win 7230, options [nop,nop,TS val 2304024199 ecr 1535692207], length 0
23:41:10.991007 IP ip-172-31-41-50.ap-northeast-2.compute.internal.http-alt > 1.238.129.195.53973: Flags [P.], seq 855883:911715, ack 412, win 487, options [nop,nop,TS val 1535692218 ecr 2304024199], length 55832: HTTP
23:41:11.001834 IP 1.238.129.195.53973 > ip-172-31-41-50.ap-northeast-2.compute.internal.http-alt: Flags [.], ack 451891, win 13610, options [nop,nop,TS val 2304024205 ecr 1535692216], length 0
23:41:11.001845 IP ip-172-31-41-50.ap-northeast-2.compute.internal.http-alt > 1.238.129.195.53973: Flags [P.], seq 911715:917507, ack 412, win 487, options [nop,nop,TS val 1535692229 ecr 2304024205], length 5792: HTTP
23:41:11.001955 IP 1.238.129.195.53973 > ip-172-31-41-50.ap-northeast-2.compute.internal.http-alt: Flags [.], ack 499675, win 13655, options [nop,nop,TS val 2304024205 ecr 1535692216], length 0
23:41:11.001955 IP 1.238.129.195.53973 > ip-172-31-41-50.ap-northeast-2.compute.internal.http-alt: Flags [.], ack 560491, win 13655, options [nop,nop,TS val 2304024206 ecr 1535692216], length 0
23:41:11.001964 IP ip-172-31-41-50.ap-northeast-2.compute.internal.http-alt > 1.238.129.195.53973: Flags [P.], seq 917507:921043, ack 412, win 487, options [nop,nop,TS val 1535692229 ecr 2304024205], length 3536: HTTP
23:41:11.001978 IP ip-172-31-41-50.ap-northeast-2.compute.internal.http-alt > 1.238.129.195.53973: Flags [P.], seq 921043:986203, ack 412, win 487, options [nop,nop,TS val 1535692229 ecr 2304024205], length 65160: HTTP
23:41:11.002005 IP ip-172-31-41-50.ap-northeast-2.compute.internal.http-alt > 1.238.129.195.53973: Flags [P.], seq 986203:1051363, ack 412, win 487, options [nop,nop,TS val 1535692229 ecr 2304024206], length 65160: HTTP
23:41:11.002027 IP 1.238.129.195.53973 > ip-172-31-41-50.ap-northeast-2.compute.internal.http-alt: Flags [.], ack 606827, win 13655, options [nop,nop,TS val 2304024207 ecr 1535692216], length 0
23:41:11.002027 IP 1.238.129.195.53973 > ip-172-31-41-50.ap-northeast-2.compute.internal.http-alt: Flags [.], ack 656059, win 13655, options [nop,nop,TS val 2304024207 ecr 1535692216], length 0
23:41:11.002027 IP 1.238.129.195.53973 > ip-172-31-41-50.ap-northeast-2.compute.internal.http-alt: Flags [.], ack 700947, win 13655, options [nop,nop,TS val 2304024207 ecr 1535692217], length 0
23:41:11.002027 IP 1.238.129.195.53973 > ip-172-31-41-50.ap-northeast-2.compute.internal.http-alt: Flags [.], ack 748731, win 13655, options [nop,nop,TS val 2304024208 ecr 1535692217], length 0
23:41:11.002072 IP 1.238.129.195.53973 > ip-172-31-41-50.ap-northeast-2.compute.internal.http-alt: Flags [.], ack 786379, win 13655, options [nop,nop,TS val 2304024209 ecr 1535692217], length 0
23:41:11.002073 IP 1.238.129.195.53973 > ip-172-31-41-50.ap-northeast-2.compute.internal.http-alt: Flags [.], ack 837059, win 13655, options [nop,nop,TS val 2304024209 ecr 1535692218], length 0
23:41:11.002078 IP ip-172-31-41-50.ap-northeast-2.compute.internal.http-alt > 1.238.129.195.53973: Flags [P.], seq 1051363:1116523, ack 412, win 487, options [nop,nop,TS val 1535692229 ecr 2304024209], length 65160: HTTP
23:41:11.002147 IP ip-172-31-41-50.ap-northeast-2.compute.internal.http-alt > 1.238.129.195.53973: Flags [P.], seq 1116523:1181683, ack 412, win 487, options [nop,nop,TS val 1535692229 ecr 2304024209], length 65160: HTTP
23:41:11.002452 IP ip-172-31-41-50.ap-northeast-2.compute.internal.http-alt > 1.238.129.195.53973: Flags [P.], seq 1181683:1246843, ack 412, win 487, options [nop,nop,TS val 1535692229 ecr 2304024209], length 65160: HTTP
23:41:11.002670 IP ip-172-31-41-50.ap-northeast-2.compute.internal.http-alt > 1.238.129.195.53973: Flags [P.], seq 1246843:1312003, ack 412, win 487, options [nop,nop,TS val 1535692229 ecr 2304024209], length 65160: HTTP
23:41:11.002683 IP ip-172-31-41-50.ap-northeast-2.compute.internal.http-alt > 1.238.129.195.53973: Flags [P.], seq 1312003:1377163, ack 412, win 487, options [nop,nop,TS val 1535692229 ecr 2304024209], length 65160: HTTP
23:41:11.002904 IP ip-172-31-41-50.ap-northeast-2.compute.internal.http-alt > 1.238.129.195.53973: Flags [P.], seq 1377163:1442323, ack 412, win 487, options [nop,nop,TS val 1535692230 ecr 2304024209], length 65160: HTTP
23:41:11.003026 IP ip-172-31-41-50.ap-northeast-2.compute.internal.http-alt > 1.238.129.195.53973: Flags [P.], seq 1442323:1507483, ack 412, win 487, options [nop,nop,TS val 1535692230 ecr 2304024209], length 65160: HTTP
23:41:11.003178 IP ip-172-31-41-50.ap-northeast-2.compute.internal.http-alt > 1.238.129.195.53973: Flags [P.], seq 1507483:1572643, ack 412, win 487, options [nop,nop,TS val 1535692230 ecr 2304024209], length 65160: HTTP
23:41:11.003378 IP ip-172-31-41-50.ap-northeast-2.compute.internal.http-alt > 1.238.129.195.53973: Flags [P.], seq 1572643:1637803, ack 412, win 487, options [nop,nop,TS val 1535692230 ecr 2304024209], length 65160: HTTP
23:41:11.003743 IP 1.238.129.195.53973 > ip-172-31-41-50.ap-northeast-2.compute.internal.http-alt: Flags [.], ack 883395, win 13655, options [nop,nop,TS val 2304024210 ecr 1535692218], length 0
23:41:11.003757 IP ip-172-31-41-50.ap-northeast-2.compute.internal.http-alt > 1.238.129.195.53973: Flags [P.], seq 1637803:1702963, ack 412, win 487, options [nop,nop,TS val 1535692230 ecr 2304024210], length 65160: HTTP
23:41:11.003785 IP 1.238.129.195.53973 > ip-172-31-41-50.ap-northeast-2.compute.internal.http-alt: Flags [.], ack 911715, win 13655, options [nop,nop,TS val 2304024210 ecr 1535692218], length 0
23:41:11.003790 IP ip-172-31-41-50.ap-northeast-2.compute.internal.http-alt > 1.238.129.195.53973: Flags [P.], seq 1702963:1768123, ack 412, win 487, options [nop,nop,TS val 1535692230 ecr 2304024210], length 65160: HTTP
23:41:11.003832 IP ip-172-31-41-50.ap-northeast-2.compute.internal.http-alt > 1.238.129.195.53973: Flags [P.], seq 1768123:1785499, ack 412, win 487, options [nop,nop,TS val 1535692230 ecr 2304024210], length 17376: HTTP
23:41:11.019677 IP 1.238.129.195.53973 > ip-172-31-41-50.ap-northeast-2.compute.internal.http-alt: Flags [.], ack 914611, win 28859, options [nop,nop,TS val 2304024217 ecr 1535692229], length 0
23:41:11.019677 IP 1.238.129.195.53973 > ip-172-31-41-50.ap-northeast-2.compute.internal.http-alt: Flags [.], ack 960139, win 28904, options [nop,nop,TS val 2304024218 ecr 1535692229], length 0
23:41:11.019677 IP 1.238.129.195.53973 > ip-172-31-41-50.ap-northeast-2.compute.internal.http-alt: Flags [.], ack 1019507, win 28904, options [nop,nop,TS val 2304024218 ecr 1535692229], length 0
23:41:11.019689 IP ip-172-31-41-50.ap-northeast-2.compute.internal.http-alt > 1.238.129.195.53973: Flags [P.], seq 1785499:1833283, ack 412, win 487, options [nop,nop,TS val 1535692246 ecr 2304024217], length 47784: HTTP
23:41:11.019715 IP ip-172-31-41-50.ap-northeast-2.compute.internal.http-alt > 1.238.129.195.53973: Flags [P.], seq 1833283:1898443, ack 412, win 487, options [nop,nop,TS val 1535692246 ecr 2304024218], length 65160: HTTP
23:41:11.019733 IP ip-172-31-41-50.ap-northeast-2.compute.internal.http-alt > 1.238.129.195.53973: Flags [P.], seq 1898443:1963603, ack 412, win 487, options [nop,nop,TS val 1535692246 ecr 2304024218], length 65160: HTTP
23:41:11.019762 IP 1.238.129.195.53973 > ip-172-31-41-50.ap-northeast-2.compute.internal.http-alt: Flags [.], ack 1065843, win 28904, options [nop,nop,TS val 2304024218 ecr 1535692229], length 0
23:41:11.019762 IP 1.238.129.195.53973 > ip-172-31-41-50.ap-northeast-2.compute.internal.http-alt: Flags [.], ack 1113627, win 28904, options [nop,nop,TS val 2304024220 ecr 1535692229], length 0
23:41:11.019762 IP 1.238.129.195.53973 > ip-172-31-41-50.ap-northeast-2.compute.internal.http-alt: Flags [.], ack 1122315, win 28904, options [nop,nop,TS val 2304024220 ecr 1535692229], length 0
23:41:11.019762 IP 1.238.129.195.53973 > ip-172-31-41-50.ap-northeast-2.compute.internal.http-alt: Flags [.], ack 1168651, win 28904, options [nop,nop,TS val 2304024220 ecr 1535692229], length 0
23:41:11.019762 IP 1.238.129.195.53973 > ip-172-31-41-50.ap-northeast-2.compute.internal.http-alt: Flags [.], ack 1238155, win 28904, options [nop,nop,TS val 2304024221 ecr 1535692229], length 0
23:41:11.019762 IP 1.238.129.195.53973 > ip-172-31-41-50.ap-northeast-2.compute.internal.http-alt: Flags [.], ack 1284491, win 28904, options [nop,nop,TS val 2304024223 ecr 1535692229], length 0
23:41:11.019791 IP 1.238.129.195.53973 > ip-172-31-41-50.ap-northeast-2.compute.internal.http-alt: Flags [.], ack 1330827, win 28904, options [nop,nop,TS val 2304024223 ecr 1535692229], length 0
23:41:11.019791 IP 1.238.129.195.53973 > ip-172-31-41-50.ap-northeast-2.compute.internal.http-alt: Flags [.], ack 1362683, win 28904, options [nop,nop,TS val 2304024223 ecr 1535692229], length 0
23:41:11.019791 IP 1.238.129.195.53973 > ip-172-31-41-50.ap-northeast-2.compute.internal.http-alt: Flags [.], ack 1417707, win 28904, options [nop,nop,TS val 2304024224 ecr 1535692230], length 0
23:41:11.019798 IP 1.238.129.195.53973 > ip-172-31-41-50.ap-northeast-2.compute.internal.http-alt: Flags [.], ack 1465491, win 28904, options [nop,nop,TS val 2304024224 ecr 1535692230], length 0
23:41:11.019817 IP 1.238.129.195.53973 > ip-172-31-41-50.ap-northeast-2.compute.internal.http-alt: Flags [.], ack 1490107, win 28904, options [nop,nop,TS val 2304024224 ecr 1535692230], length 0
23:41:11.019817 IP 1.238.129.195.53973 > ip-172-31-41-50.ap-northeast-2.compute.internal.http-alt: Flags [.], ack 1536443, win 28904, options [nop,nop,TS val 2304024225 ecr 1535692230], length 0
23:41:11.019834 IP 1.238.129.195.53973 > ip-172-31-41-50.ap-northeast-2.compute.internal.http-alt: Flags [.], ack 1585675, win 28904, options [nop,nop,TS val 2304024225 ecr 1535692230], length 0
23:41:11.019854 IP 1.238.129.195.53973 > ip-172-31-41-50.ap-northeast-2.compute.internal.http-alt: Flags [.], ack 1604499, win 28904, options [nop,nop,TS val 2304024225 ecr 1535692230], length 0
23:41:11.019854 IP 1.238.129.195.53973 > ip-172-31-41-50.ap-northeast-2.compute.internal.http-alt: Flags [.], ack 1656627, win 28904, options [nop,nop,TS val 2304024227 ecr 1535692230], length 0
23:41:11.019881 IP 1.238.129.195.53973 > ip-172-31-41-50.ap-northeast-2.compute.internal.http-alt: Flags [.], ack 1705859, win 28904, options [nop,nop,TS val 2304024227 ecr 1535692230], length 0
23:41:11.020007 IP ip-172-31-41-50.ap-northeast-2.compute.internal.http-alt > 1.238.129.195.53973: Flags [P.], seq 1963603:2028763, ack 412, win 487, options [nop,nop,TS val 1535692247 ecr 2304024227], length 65160: HTTP
23:41:11.020150 IP ip-172-31-41-50.ap-northeast-2.compute.internal.http-alt > 1.238.129.195.53973: Flags [P.], seq 2028763:2093923, ack 412, win 487, options [nop,nop,TS val 1535692247 ecr 2304024227], length 65160: HTTP
23:41:11.020400 IP 1.238.129.195.53973 > ip-172-31-41-50.ap-northeast-2.compute.internal.http-alt: Flags [.], ack 1727579, win 28904, options [nop,nop,TS val 2304024227 ecr 1535692230], length 0
23:41:11.020593 IP 1.238.129.195.53973 > ip-172-31-41-50.ap-northeast-2.compute.internal.http-alt: Flags [.], ack 1773915, win 28904, options [nop,nop,TS val 2304024229 ecr 1535692230], length 0
23:41:11.020710 IP ip-172-31-41-50.ap-northeast-2.compute.internal.http-alt > 1.238.129.195.53973: Flags [P.], seq 2093923:2159083, ack 412, win 487, options [nop,nop,TS val 1535692247 ecr 2304024227], length 65160: HTTP
23:41:11.020735 IP ip-172-31-41-50.ap-northeast-2.compute.internal.http-alt > 1.238.129.195.53973: Flags [P.], seq 2159083:2224243, ack 412, win 487, options [nop,nop,TS val 1535692247 ecr 2304024227], length 65160: HTTP
23:41:11.021446 IP ip-172-31-41-50.ap-northeast-2.compute.internal.http-alt > 1.238.129.195.53973: Flags [P.], seq 2224243:2289403, ack 412, win 487, options [nop,nop,TS val 1535692248 ecr 2304024227], length 65160: HTTP
23:41:11.021469 IP ip-172-31-41-50.ap-northeast-2.compute.internal.http-alt > 1.238.129.195.53973: Flags [P.], seq 2289403:2354563, ack 412, win 487, options [nop,nop,TS val 1535692248 ecr 2304024227], length 65160: HTTP
23:41:11.021739 IP 1.238.129.195.53973 > ip-172-31-41-50.ap-northeast-2.compute.internal.http-alt: Flags [.], ack 1785499, win 28904, options [nop,nop,TS val 2304024229 ecr 1535692230], length 0
23:41:11.021796 IP ip-172-31-41-50.ap-northeast-2.compute.internal.http-alt > 1.238.129.195.53973: Flags [P.], seq 2354563:2419723, ack 412, win 487, options [nop,nop,TS val 1535692248 ecr 2304024229], length 65160: HTTP
23:41:11.022032 IP ip-172-31-41-50.ap-northeast-2.compute.internal.http-alt > 1.238.129.195.53973: Flags [P.], seq 2419723:2484883, ack 412, win 487, options [nop,nop,TS val 1535692249 ecr 2304024229], length 65160: HTTP
23:41:11.022052 IP ip-172-31-41-50.ap-northeast-2.compute.internal.http-alt > 1.238.129.195.53973: Flags [P.], seq 2484883:2550043, ack 412, win 487, options [nop,nop,TS val 1535692249 ecr 2304024229], length 65160: HTTP
23:41:11.022165 IP ip-172-31-41-50.ap-northeast-2.compute.internal.http-alt > 1.238.129.195.53973: Flags [P.], seq 2550043:2615203, ack 412, win 487, options [nop,nop,TS val 1535692249 ecr 2304024229], length 65160: HTTP
23:41:11.022340 IP ip-172-31-41-50.ap-northeast-2.compute.internal.http-alt > 1.238.129.195.53973: Flags [P.], seq 2615203:2680363, ack 412, win 487, options [nop,nop,TS val 1535692249 ecr 2304024229], length 65160: HTTP
23:41:11.022480 IP ip-172-31-41-50.ap-northeast-2.compute.internal.http-alt > 1.238.129.195.53973: Flags [P.], seq 2680363:2745523, ack 412, win 487, options [nop,nop,TS val 1535692249 ecr 2304024229], length 65160: HTTP
23:41:11.022668 IP ip-172-31-41-50.ap-northeast-2.compute.internal.http-alt > 1.238.129.195.53973: Flags [P.], seq 2745523:2810683, ack 412, win 487, options [nop,nop,TS val 1535692249 ecr 2304024229], length 65160: HTTP
23:41:11.022804 IP ip-172-31-41-50.ap-northeast-2.compute.internal.http-alt > 1.238.129.195.53973: Flags [P.], seq 2810683:2875843, ack 412, win 487, options [nop,nop,TS val 1535692249 ecr 2304024229], length 65160: HTTP
23:41:11.022999 IP ip-172-31-41-50.ap-northeast-2.compute.internal.http-alt > 1.238.129.195.53973: Flags [P.], seq 2875843:2941003, ack 412, win 487, options [nop,nop,TS val 1535692250 ecr 2304024229], length 65160: HTTP
23:41:11.023142 IP ip-172-31-41-50.ap-northeast-2.compute.internal.http-alt > 1.238.129.195.53973: Flags [P.], seq 2941003:3006163, ack 412, win 487, options [nop,nop,TS val 1535692250 ecr 2304024229], length 65160: HTTP
23:41:11.023322 IP ip-172-31-41-50.ap-northeast-2.compute.internal.http-alt > 1.238.129.195.53973: Flags [P.], seq 3006163:3065531, ack 412, win 487, options [nop,nop,TS val 1535692250 ecr 2304024229], length 59368: HTTP
23:41:11.030121 IP 1.238.129.195.53973 > ip-172-31-41-50.ap-northeast-2.compute.internal.http-alt: Flags [.], ack 1788395, win 54561, options [nop,nop,TS val 2304024235 ecr 1535692246], length 0
23:41:11.030133 IP ip-172-31-41-50.ap-northeast-2.compute.internal.http-alt > 1.238.129.195.53973: Flags [P.], seq 3065531:3069875, ack 412, win 487, options [nop,nop,TS val 1535692257 ecr 2304024235], length 4344: HTTP
23:41:11.030295 IP 1.238.129.195.53973 > ip-172-31-41-50.ap-northeast-2.compute.internal.http-alt: Flags [.], ack 1885411, win 54606, options [nop,nop,TS val 2304024237 ecr 1535692246], length 0
23:41:11.030295 IP 1.238.129.195.53973 > ip-172-31-41-50.ap-northeast-2.compute.internal.http-alt: Flags [.], ack 1905683, win 54606, options [nop,nop,TS val 2304024237 ecr 1535692246], length 0
23:41:11.030303 IP ip-172-31-41-50.ap-northeast-2.compute.internal.http-alt > 1.238.129.195.53973: Flags [.], seq 3069875:3071323, ack 412, win 487, options [nop,nop,TS val 1535692257 ecr 2304024237], length 1448: HTTP
23:41:11.030311 IP ip-172-31-41-50.ap-northeast-2.compute.internal.http-alt > 1.238.129.195.53973: Flags [P.], seq 3071323:3136483, ack 412, win 487, options [nop,nop,TS val 1535692257 ecr 2304024237], length 65160: HTTP
23:41:11.030337 IP 1.238.129.195.53973 > ip-172-31-41-50.ap-northeast-2.compute.internal.http-alt: Flags [.], ack 1956363, win 54606, options [nop,nop,TS val 2304024237 ecr 1535692246], length 0
23:41:11.030345 IP ip-172-31-41-50.ap-northeast-2.compute.internal.http-alt > 1.238.129.195.53973: Flags [P.], seq 3136483:3201643, ack 412, win 487, options [nop,nop,TS val 1535692257 ecr 2304024237], length 65160: HTTP
23:41:11.030355 IP 1.238.129.195.53973 > ip-172-31-41-50.ap-northeast-2.compute.internal.http-alt: Flags [.], ack 2011387, win 54606, options [nop,nop,TS val 2304024238 ecr 1535692247], length 0
23:41:11.030546 IP ip-172-31-41-50.ap-northeast-2.compute.internal.http-alt > 1.238.129.195.53973: Flags [P.], seq 3201643:3266803, ack 412, win 487, options [nop,nop,TS val 1535692257 ecr 2304024238], length 65160: HTTP
23:41:11.045255 IP 1.238.129.195.53973 > ip-172-31-41-50.ap-northeast-2.compute.internal.http-alt: Flags [.], ack 2059171, win 54606, options [nop,nop,TS val 2304024238 ecr 1535692247], length 0
23:41:11.045267 IP ip-172-31-41-50.ap-northeast-2.compute.internal.http-alt > 1.238.129.195.53973: Flags [P.], seq 3266803:3331963, ack 412, win 487, options [nop,nop,TS val 1535692272 ecr 2304024238], length 65160: HTTP
23:41:11.045398 IP 1.238.129.195.53973 > ip-172-31-41-50.ap-northeast-2.compute.internal.http-alt: Flags [.], ack 2105507, win 54606, options [nop,nop,TS val 2304024240 ecr 1535692247], length 0
23:41:11.045398 IP 1.238.129.195.53973 > ip-172-31-41-50.ap-northeast-2.compute.internal.http-alt: Flags [.], ack 2112747, win 54606, options [nop,nop,TS val 2304024240 ecr 1535692247], length 0
23:41:11.045406 IP ip-172-31-41-50.ap-northeast-2.compute.internal.http-alt > 1.238.129.195.53973: Flags [P.], seq 3331963:3397123, ack 412, win 487, options [nop,nop,TS val 1535692272 ecr 2304024240], length 65160: HTTP
23:41:11.045439 IP 1.238.129.195.53973 > ip-172-31-41-50.ap-northeast-2.compute.internal.http-alt: Flags [.], ack 2163427, win 54606, options [nop,nop,TS val 2304024240 ecr 1535692247], length 0
23:41:11.045467 IP 1.238.129.195.53973 > ip-172-31-41-50.ap-northeast-2.compute.internal.http-alt: Flags [.], ack 2211211, win 54606, options [nop,nop,TS val 2304024241 ecr 1535692247], length 0
23:41:11.045507 IP 1.238.129.195.53973 > ip-172-31-41-50.ap-northeast-2.compute.internal.http-alt: Flags [.], ack 2237275, win 54606, options [nop,nop,TS val 2304024241 ecr 1535692248], length 0
23:41:11.045526 IP 1.238.129.195.53973 > ip-172-31-41-50.ap-northeast-2.compute.internal.http-alt: Flags [.], ack 2285059, win 54606, options [nop,nop,TS val 2304024241 ecr 1535692248], length 0
23:41:11.045567 IP ip-172-31-41-50.ap-northeast-2.compute.internal.http-alt > 1.238.129.195.53973: Flags [P.], seq 3397123:3462283, ack 412, win 487, options [nop,nop,TS val 1535692272 ecr 2304024241], length 65160: HTTP
23:41:11.045614 IP 1.238.129.195.53973 > ip-172-31-41-50.ap-northeast-2.compute.internal.http-alt: Flags [.], ack 2335739, win 54606, options [nop,nop,TS val 2304024242 ecr 1535692248], length 0
23:41:11.045615 IP 1.238.129.195.53973 > ip-172-31-41-50.ap-northeast-2.compute.internal.http-alt: Flags [.], ack 2356011, win 54606, options [nop,nop,TS val 2304024242 ecr 1535692248], length 0
23:41:11.045615 IP 1.238.129.195.53973 > ip-172-31-41-50.ap-northeast-2.compute.internal.http-alt: Flags [.], ack 2402347, win 54606, options [nop,nop,TS val 2304024242 ecr 1535692248], length 0
23:41:11.045627 IP 1.238.129.195.53973 > ip-172-31-41-50.ap-northeast-2.compute.internal.http-alt: Flags [.], ack 2468955, win 54606, options [nop,nop,TS val 2304024244 ecr 1535692248], length 0
23:41:11.045631 IP 1.238.129.195.53973 > ip-172-31-41-50.ap-northeast-2.compute.internal.http-alt: Flags [.], ack 2500811, win 54606, options [nop,nop,TS val 2304024246 ecr 1535692249], length 0
23:41:11.045650 IP 1.238.129.195.53973 > ip-172-31-41-50.ap-northeast-2.compute.internal.http-alt: Flags [.], ack 2519635, win 54606, options [nop,nop,TS val 2304024246 ecr 1535692249], length 0
23:41:11.045651 IP 1.238.129.195.53973 > ip-172-31-41-50.ap-northeast-2.compute.internal.http-alt: Flags [.], ack 2528323, win 54606, options [nop,nop,TS val 2304024247 ecr 1535692249], length 0
23:41:11.045666 IP 1.238.129.195.53973 > ip-172-31-41-50.ap-northeast-2.compute.internal.http-alt: Flags [.], ack 2558731, win 54606, options [nop,nop,TS val 2304024248 ecr 1535692249], length 0
23:41:11.045689 IP 1.238.129.195.53973 > ip-172-31-41-50.ap-northeast-2.compute.internal.http-alt: Flags [.], ack 2586243, win 54606, options [nop,nop,TS val 2304024250 ecr 1535692249], length 0
23:41:11.045689 IP 1.238.129.195.53973 > ip-172-31-41-50.ap-northeast-2.compute.internal.http-alt: Flags [.], ack 2648507, win 54606, options [nop,nop,TS val 2304024251 ecr 1535692249], length 0
23:41:11.045708 IP 1.238.129.195.53973 > ip-172-31-41-50.ap-northeast-2.compute.internal.http-alt: Flags [.], ack 2694843, win 54606, options [nop,nop,TS val 2304024251 ecr 1535692249], length 0
23:41:11.045708 IP 1.238.129.195.53973 > ip-172-31-41-50.ap-northeast-2.compute.internal.http-alt: Flags [.], ack 2725251, win 54131, options [nop,nop,TS val 2304024251 ecr 1535692249,nop,nop,sack 1 {2741179:2757107}], length 0
